{
  "$schema": "https://json-schema.org/draft/2020-12/schema",
  "$id": "qualification-authority-state-receipt.schema.json",
  "title": "OpenAdapt qualification authority state receipt v2",
  "type": "object",
  "additionalProperties": false,
  "required": [
    "schema_version", "authority_state_sha256", "status",
    "signer_registry_sha256", "signer_registry_identity_sha256",
    "signer_registry_revision", "evidence_authority_sha256", "observed_at",
    "not_before", "expires_at", "issuer_key_id", "algorithm",
    "signing_statement", "signature", "issuer"
  ],
  "properties": {
    "schema_version": {"const": "openadapt.qualification-authority-state-receipt/v2"},
    "authority_state_sha256": {"$ref": "#/$defs/digest"},
    "status": {"const": "active"},
    "signer_registry_sha256": {"$ref": "#/$defs/digest"},
    "signer_registry_identity_sha256": {"$ref": "#/$defs/digest"},
    "signer_registry_revision": {"type": "integer", "minimum": 1},
    "evidence_authority_sha256": {"$ref": "#/$defs/digest"},
    "observed_at": {"$ref": "#/$defs/timestamp"},
    "not_before": {"$ref": "#/$defs/timestamp"},
    "expires_at": {"oneOf": [{"$ref": "#/$defs/timestamp"}, {"type": "null"}]},
    "issuer_key_id": {"type": "string", "pattern": "^qa-ed25519-[0-9a-f]{16}$"},
    "algorithm": {"const": "ed25519"},
    "signing_statement": {
      "allOf": [
        {"$ref": "qualification-evidence-signing-statement.schema.json"},
        {"properties": {
          "object_schema_version": {
            "const": "openadapt.qualification-authority-state-receipt/v2"
          },
          "signature_domain": {
            "const": "OpenAdapt qualification authority state receipt v2\u0000"
          }
        }}
      ]
    },
    "signature": {"type": "string", "pattern": "^[A-Za-z0-9+/]{86}==$"},
    "issuer": {"$ref": "#/$defs/issuer"}
  },
  "$defs": {
    "digest": {"type": "string", "pattern": "^sha256:[0-9a-f]{64}$"},
    "commit": {"type": "string", "pattern": "^[0-9a-f]{40}$"},
    "timestamp": {"type": "string", "pattern": "^[0-9]{4}-[0-9]{2}-[0-9]{2}T[0-9]{2}:[0-9]{2}:[0-9]{2}Z$"},
    "issuer": {
      "type": "object",
      "additionalProperties": false,
      "required": ["repository", "repository_id", "repository_owner_id", "workflow", "ref", "source_commit", "environment"],
      "properties": {
        "repository": {"const": "OpenAdaptAI/openadapt-ops"},
        "repository_id": {"const": "1172011294"},
        "repository_owner_id": {"const": "132681217"},
        "workflow": {"const": ".github/workflows/qualification-authority-state.yml"},
        "ref": {"const": "refs/heads/main"},
        "source_commit": {"$ref": "#/$defs/commit"},
        "environment": {"const": "qualification-authority-state"}
      }
    }
  }
}
