{"algorithm":"ed25519","authority_state_sha256":"sha256:ea973da8b764f89a56e9f74100c049d3c5d92d8e31b2a42131651242aca44dfb","evidence_authority_sha256":"sha256:1aa7cfcb5f3df6b99372a28c305177e046487c8ec5b61111edbf1a12d3e76663","expires_at":"2026-09-09T17:59:26Z","issuer":{"environment":"qualification-authority-state","ref":"refs/heads/main","repository":"OpenAdaptAI/openadapt-ops","repository_id":"1172011294","repository_owner_id":"132681217","source_commit":"e323249e3a7c1af9d7651312e0afe1f12c38c977","workflow":".github/workflows/qualification-authority-state.yml"},"issuer_key_id":"qa-ed25519-9cf4bca214c01d79","not_before":"2026-09-02T17:59:26Z","observed_at":"2026-09-02T17:59:26Z","schema_version":"openadapt.qualification-authority-state-receipt/v2","signature":"S0gCpusTp48CwMFBED9YWibchhDA3E3XrMasJzScDZDPUq6u/KhFPZi6t0OdfkYf2++Q0Ql4Pm+0+caNPw8iDA==","signer_registry_identity_sha256":"sha256:728e0d4f7c2a85a256ae3bf95a3ed56708daf818252c2b19525efc61e81ca1bc","signer_registry_revision":1,"signer_registry_sha256":"sha256:1a95efc9c22e2c7f6139050469bc3ea282c1e7611abc0bdc0e3aecba5a38b677","signing_statement":{"commitment_scheme":"sha256-canonical-json-lf","object_schema_version":"openadapt.qualification-authority-state-receipt/v2","schema_version":"openadapt.qualification-evidence-signing-statement/v1","signature_domain":"OpenAdapt qualification authority state receipt v2\u0000","unsigned_object_sha256":"sha256:ef2c3f89e8d94551eb4cb84fb573d8c57c461e2cb428b2d556f666d12efafe77","unsigned_size_bytes":1013},"status":"active"}
