{"algorithm":"ed25519","authority_state_sha256":"sha256:df5079141df68877c4b06f05b9fb9fdf279307b7629eb1f2dce12def4bd5e2fa","evidence_authority_sha256":"sha256:1aa7cfcb5f3df6b99372a28c305177e046487c8ec5b61111edbf1a12d3e76663","expires_at":null,"issuer":{"environment":"qualification-authority-state","ref":"refs/heads/main","repository":"OpenAdaptAI/openadapt-ops","repository_id":"1172011294","repository_owner_id":"132681217","source_commit":"e323249e3a7c1af9d7651312e0afe1f12c38c977","workflow":".github/workflows/qualification-authority-state.yml"},"issuer_key_id":"qa-ed25519-9cf4bca214c01d79","not_before":"2026-09-02T18:24:25Z","observed_at":"2026-09-02T18:24:25Z","schema_version":"openadapt.qualification-authority-state-receipt/v2","signature":"BUa1NvZFvbPv7pari55YjS6C7p6U68c2Jjrh0vt9u+ZFky8Y6w/9p+55MggWJP8zwghMIT+HM1YlqH5++ciOBQ==","signer_registry_identity_sha256":"sha256:e243a23243b24986ed08812e284a1bd8c4993814149f02bcba79cc520e10ca14","signer_registry_revision":1,"signer_registry_sha256":"sha256:7a81bf3d213c74673f3c6b5fa179234cbee534c9432aaea6ae09e455562f96b6","signing_statement":{"commitment_scheme":"sha256-canonical-json-lf","object_schema_version":"openadapt.qualification-authority-state-receipt/v2","schema_version":"openadapt.qualification-evidence-signing-statement/v1","signature_domain":"OpenAdapt qualification authority state receipt v2\u0000","unsigned_object_sha256":"sha256:be362f1c032e0f0ee8f8ad378efe7b84fb55ea5e9260977a2b9fc2e41dda9b17","unsigned_size_bytes":995},"status":"active"}
